{
  "contract_version": "1.0",
  "provider_id": "dev.openeos.control",
  "provider_version": "0.5.0",
  "session_id": "session-demo-0001",
  "media_id": "media-demo-0001",
  "capture_correlation_id": null,
  "captured_at": null,
  "filename": "UNKNOWN.BIN",
  "media_kind": "OTHER",
  "mime_type": null,
  "byte_length": null,
  "source_checksum": null,
  "source_revision": null,
  "camera_id": "camera-session-0001",
  "camera_model": "Canon EOS Camera",
  "storage_id": "storage-session-0001",
  "storage_label": null,
  "width": null,
  "height": null,
  "orientation": null,
  "capture_group_hint": null,
  "companion_role": null,
  "available_representations": ["ORIGINAL"],
  "range_supported": false,
  "resume_supported": false,
  "cancel_supported": true
}
